{
  "schema_version": "1.0",
  "created_at": "2026-03-02T00:00:00Z",
  "program_id": "vodafone",
  "name": "Vodafone Group",
  "platform": "hackerone",
  "program_url": "https://hackerone.com/vodafone",
  "non_monetary": true,
  "in_scope": {
    "domains": [
      "*.vodafone.com",
      "*.vodafone.co.uk",
      "*.voxi.co.uk",
      "*.vcol.co.uk",
      "*.vodafoneaws.co.uk",
      "*.vodafoneinnovus.com",
      "*.vantagetowers.com",
      "*.vodafone.ie",
      "*.vodafone.ro",
      "*.lowi.es",
      "*.vodafone.es",
      "*.vodafoneempresa.es",
      "*.ayudavodafone.es",
      "*.upc.hu",
      "*.vodafone.pt",
      "*.vfpt.pt",
      "*.vodafone.com.tr",
      "*.vodafonepay.com.tr",
      "*.vodafonepark.com.tr",
      "*.vodacom.co.ls",
      "*.m-pesa.co.tz",
      "*.m-pesa.com",
      "*.vm.co.mz",
      "*.vodacom.co.tz",
      "*.vodacom.co.za",
      "*.mobile.securenet.vodafone.com",
      "*.onenumber.vodafone.com",
      "*.securenet.vodafone.com",
      "*.mobile.securenet.vodafone.es",
      "*.securenet.vodafone.es",
      "*.securenet.vodafone.de",
      "*.mobile.securenet.vodafone.gr",
      "*.securenet.vodafone.ie",
      "*.securenet.vodafone.it",
      "*.automotive.vodafone.com",
      "*.automotive.vodafone.de",
      "*.automotive.vodafone.it",
      "*.automotive.vodafone.co.uk",
      "*.automotive.vodafone.es",
      "*.iotportal.vodafone.com",
      "*.iot.vodafone.swisscom.ch",
      "*.iot.vm.co.mz",
      "*.iot.vodafone.al",
      "*.iot.vodafone.gr",
      "*.iot.vodafone.ro",
      "*.iot.vodafone.tr",
      "*.iot.vodafoneinnovus.com",
      "*.oitsimcontrol.safaricom.co.ke",
      "*.vodafone.cz",
      "*.my.upc.cz",
      "*.upc.cz",
      "*.unitymedia.de",
      "*.vodafone.de",
      "*.dsl.vodafone.de",
      "*.vodafone-ip.de",
      "*.vodafonemail.de",
      "*.vodafone.gr",
      "*.vodafonecu.gr",
      "*.vodafonehosting.gr",
      "*.vodafone.it",
      "*.voda.it",
      "*.vnd.it",
      "*.vodafoneadsl.it",
      "*.abcom.al",
      "*.vodafone.al",
      "*.my.vodafone.al"
    ],
    "ip_ranges": [],
    "endpoints": [],
    "mobile_apps": []
  },
  "out_of_scope": {
    "domains": [
      "cst-prg-*-*.cust.vodafone.cz",
      "cst2-*-*.cust.vodafone.cz",
      "*.pools.vodafone-ip.de",
      "*.pool2.vodafone-ip.de",
      "*.rev.vodafone.pt",
      "*.mynet.vodafone.it",
      "*.cust.vodafonedsl.it",
      "*.ens.vodacom.co.za",
      "net-x-x-x-x.cust.dsl.vodafone.it",
      "prg-x-xxx.static.adsl.vodafone.cz",
      "vpn4.vodafone-us.com",
      "smart.vodafone.com.eg"
    ],
    "ip_ranges": [],
    "endpoints": [],
    "test_types": [
      "mitm",
      "dos",
      "brute_force",
      "social_engineering"
    ]
  },
  "allowed_test_types": [
    "recon",
    "web_scan",
    "xss",
    "sqli",
    "ssti",
    "auth_bypass",
    "idor",
    "open_redirect",
    "csrf",
    "secrets_scan",
    "supply_chain"
  ],
  "contact": {
    "disclosure_policy_url": "https://hackerone.com/vodafone",
    "response_sla_days": 2
  },
  "notes": "VDP — no bounty. H1 username: lazerwild. REQUIRED: add X-HackerOne-Research: lazerwild header to all requests. ISP customer-assigned IP ranges are NOT in scope even if they resolve to Vodafone FQDNs. Validate asset ownership before reporting. Known vulnerable libraries require working PoC. No brute force on non-auth endpoints. Static resources in storage buckets are OOS. High-value targets: m-pesa.com (mobile money), iotportal.vodafone.com (IoT), securenet.vodafone.com (security product), automotive.vodafone.com (connected vehicle). Program launched Feb 2026 — fresh, low coverage, 100% response efficiency."
}
