{
  "schema_version": "1.0",
  "created_at": "2026-02-19T00:00:00Z",
  "program_id": "docusign",
  "name": "DocuSign Bug Bounty",
  "platform": "direct",
  "program_url": "https://www.docusign.com/company/security",
  "non_monetary": true,
  "in_scope": {
    "domains": [
      "*.docusign.com"
    ],
    "ip_ranges": [],
    "endpoints": [],
    "mobile_apps": []
  },
  "out_of_scope": {
    "domains": [
      "rooms.docusign.com",
      "www.rooms.docusign.com",
      "partners.docusign.com",
      "app.docusign.com",
      "admin.docusign.com",
      "*.account.docusign.com",
      "*.docusign.net",
      "www.docusign.net"
    ],
    "ip_ranges": [],
    "endpoints": [
      "https://www.docusign.net/signing/",
      "https://www.docusign.net/restapi/",
      "https://www.docusign.net/api/3.0/"
    ],
    "test_types": [
      "dos",
      "port_scan",
      "command_injection"
    ]
  },
  "allowed_test_types": [
    "recon",
    "web_scan",
    "xss",
    "sqli",
    "ssti",
    "auth_bypass",
    "idor",
    "open_redirect",
    "csrf",
    "secrets_scan",
    "supply_chain"
  ],
  "contact": {
    "disclosure_policy_url": "https://www.docusign.com/company/security",
    "response_sla_days": 90
  },
  "notes": "Production service — detection only, never exploitation. sqli uses safe level/risk only. No bruteforce against login endpoints. Out-of-scope subdomains are hard exclusions — scanner will skip any findings from those hosts. docusign.net is excluded entirely (different TLD, separate system). Wildcard *.docusign.com is in scope EXCEPT the listed exclusions."
}
